{"$id":"https://single-image-studio.invalid/research/slice-09/schemas/preregistration.slice09.v0.schema.json","$schema":"https://json-schema.org/draft/2020-12/schema","additionalProperties":false,"properties":{"allAttemptsMustPass":{"const":true},"applicableSources":{"const":3},"attempts":{"const":18},"calibrationAuthorized":{"const":false},"contentHash":{"pattern":"^[a-f0-9]{64}$","type":"string"},"contractRef":{"additionalProperties":false,"properties":{"byteLength":{"minimum":2,"type":"integer"},"contentHash":{"pattern":"^[a-f0-9]{64}$","type":"string"},"fileSha256":{"pattern":"^[a-f0-9]{64}$","type":"string"},"id":{"pattern":"^[A-Za-z0-9][A-Za-z0-9._:@-]{0,199}$","type":"string"},"path":{"maxLength":500,"minLength":1,"type":"string"}},"required":["path","id","contentHash","byteLength","fileSha256"],"type":"object"},"evidenceBoundary":{"additionalProperties":false,"properties":{"C1":{"const":0},"E1":{"const":0},"G1":{"const":0},"O1":{"const":0},"R1":{"const":0},"U1":{"const":0},"V1":{"const":0},"formal":{"const":false},"productSupport":{"const":false},"releaseAllowlist":{"const":"none"},"releaseApproved":{"const":0},"releaseRegistered":{"const":0}},"required":["C1","U1","E1","R1","O1","G1","V1","productSupport","formal","releaseAllowlist","releaseRegistered","releaseApproved"],"type":"object"},"frozenAt":{"type":"string"},"globalStopOnNonPass":{"const":true},"goldIdentityRefs":{"items":{"additionalProperties":false,"properties":{"byteLength":{"minimum":2,"type":"integer"},"contentHash":{"pattern":"^[a-f0-9]{64}$","type":"string"},"fileSha256":{"pattern":"^[a-f0-9]{64}$","type":"string"},"id":{"pattern":"^[A-Za-z0-9][A-Za-z0-9._:@-]{0,199}$","type":"string"},"path":{"maxLength":500,"minLength":1,"type":"string"}},"required":["path","id","contentHash","byteLength","fileSha256"],"type":"object"},"maxItems":3,"minItems":3,"type":"array"},"id":{"pattern":"^[A-Za-z0-9][A-Za-z0-9._:@-]{0,199}$","type":"string"},"manifestRef":{"additionalProperties":false,"properties":{"byteLength":{"minimum":2,"type":"integer"},"contentHash":{"pattern":"^[a-f0-9]{64}$","type":"string"},"fileSha256":{"pattern":"^[a-f0-9]{64}$","type":"string"},"id":{"pattern":"^[A-Za-z0-9][A-Za-z0-9._:@-]{0,199}$","type":"string"},"path":{"maxLength":500,"minLength":1,"type":"string"}},"required":["path","id","contentHash","byteLength","fileSha256"],"type":"object"},"operation":{"enum":["normalize","export"]},"planRef":{"additionalProperties":false,"properties":{"byteLength":{"minimum":2,"type":"integer"},"contentHash":{"pattern":"^[a-f0-9]{64}$","type":"string"},"fileSha256":{"pattern":"^[a-f0-9]{64}$","type":"string"},"id":{"pattern":"^[A-Za-z0-9][A-Za-z0-9._:@-]{0,199}$","type":"string"},"path":{"maxLength":500,"minLength":1,"type":"string"}},"required":["path","id","contentHash","byteLength","fileSha256"],"type":"object"},"rejectionSources":{"const":3},"repetitions":{"const":3},"replacements":{"const":0},"schemaVersion":{"const":"preregistration.slice09.v0"},"sources":{"const":6}},"required":["schemaVersion","id","operation","contractRef","planRef","manifestRef","goldIdentityRefs","sources","attempts","applicableSources","rejectionSources","repetitions","replacements","allAttemptsMustPass","globalStopOnNonPass","calibrationAuthorized","frozenAt","evidenceBoundary","contentHash"],"type":"object"}
