{"allAttemptsMustPass":true,"applicableSources":3,"attempts":18,"calibrationAuthorized":false,"contentHash":"4022d2aad1a59b6cf8e1bd2fdad5f1b644cc59c1b238a4fbf630231a8bb8255b","contractRef":{"byteLength":884,"contentHash":"4bfd1de8baa2d312f68e208a1dc982b45e05c6ee252dbdfbc76085765544794e","fileSha256":"71dc2ac0d6362a8a6415093d8c15b28296c04e0cfa6bfe1f6322685f136f974d","id":"CC-CAP02-EXPORT-PNG@0.9.0","path":"contracts/cc-cap02-export-png.v0.9.0.json"},"evidenceBoundary":{"C1":0,"E1":0,"G1":0,"O1":0,"R1":0,"U1":0,"V1":0,"formal":false,"productSupport":false,"releaseAllowlist":"none","releaseApproved":0,"releaseRegistered":0},"frozenAt":"2026-08-15T15:17:03.776Z","globalStopOnNonPass":true,"goldIdentityRefs":[{"byteLength":1705,"contentHash":"e8b4004db19343056e02e8052d4e0bd756d4e138c80e7367b2f93877985bf684","fileSha256":"9c8da64c8d22fe973999bd3a2a90934b8351c65d80e57eaac14d2540f91604c7","id":"gold-identity.s09.export.applicable.001","path":"gold-identities/export/gold-identity.s09.export.applicable.001.json"},{"byteLength":1705,"contentHash":"680e623dd5fd559646b63f4b9d8a41bde9e352b897297f40fbc22ef7da89d7db","fileSha256":"5dd03dd5d8ba2aa502e0c21d497782a52305292f40ef52ebae606772b5cecca8","id":"gold-identity.s09.export.applicable.002","path":"gold-identities/export/gold-identity.s09.export.applicable.002.json"},{"byteLength":1705,"contentHash":"2c09a4a92a2fbda24c565fa8c240c2f73d2ca347c8f9d62d3cf0b3858e8537a5","fileSha256":"a07743a6a7a9d339602281672d82fb187b9778977502161edad07e4d41660414","id":"gold-identity.s09.export.applicable.003","path":"gold-identities/export/gold-identity.s09.export.applicable.003.json"}],"id":"PREREG-GATEB-EXPORT-PNG@0.9.0","manifestRef":{"byteLength":3985,"contentHash":"298183aa987ea87d9b0abbb19e1fbcf8f21dae8d11b2f2af86bb296f813c6e48","fileSha256":"0eb829b8fe62fa28f345d7412bc11b1a0caf7042d77fd2f7db4e1e691cc22279","id":"FM-GATEB-EXPORT-PNG@0.9.0","path":"manifests/export-smoke.v0.9.0.json"},"operation":"export","planRef":{"byteLength":571,"contentHash":"aea2d439720b21197f7d48538d8496422e955bb6017e5445612187dddb59463b","fileSha256":"6d1fecc7a40b7f736ac4a73930740aa458017005957254b781345ef064a70277","id":"PLAN-GATEB-OPEN-SMOKE@0.9.0","path":"plans/gateb-open-smoke.v0.9.0.json"},"rejectionSources":3,"repetitions":3,"replacements":0,"schemaVersion":"preregistration.slice09.v0","sources":6}
